{"schema_version":"cognitive-runtime.state-import-manifest/v2","import_id":"import-synthetic","instance_id":"instance-synthetic","initialized_head_checksum":"sha256:0000000000000000000000000000000000000000000000000000000000000000","events":[{"event_id":"event-synthetic"}],"source_mappings":[{"event_id":"event-synthetic","source_kind":"user_confirmed","source_ref":"src-synthetic-note","verification":"confirmed at cutover"}],"expected_head":{"active_seq":1},"expected_view":{"view_version":"view-1"},"checksum":"sha256:1111111111111111111111111111111111111111111111111111111111111111","created_at":"2026-08-14T01:00:00Z"}
